implementation_intensity,category,definition,assigned_strategy_profiles,decision_use
0,Current practice,Current routine vaccination and standard treatment/PEP assumptions.,Current practice,Comparator and lowest-intensity reference.
1,Single routine program modification,One added or scaled routine vaccination or targeted prophylaxis component without a new diagnostic-management pathway.,Nominal coverage floor; Routine timeliness; Adolescent booster; Pregnancy Tdap scale-up; Targeted high-risk PEP,Program-only strategy profile.
2,Clinical or contact-management addition,Added close-contact adult operations or resistance-guided testing/treatment and resistant-strain PEP restoration.,Close-contact adult adjunct; Resistance-guided management,Program or resistance-management strategy profile.
3,Multi-component exposure-reduction package,"Layered infant-protection package combining pregnancy Tdap scale-up, close-contact adult protection, reproductive-age boosting, and infant-contact reduction.",Infant-exposure reduction,Composite program profile with greater operational dependence.
4,Future product target,Hypothetical vaccine product target with stronger transmission-blocking assumptions; not currently implementable as a policy lever.,Transmission-blocking vaccine target; High-transmission-blocking vaccine target,Future product-target domain only.
5,Future stress-test package,Mechanistic upper-bound profile combining future vaccine assumptions with multiple program and management components.,Combined future stress-test profile,"Stress test, not a deployable policy recommendation."
